{
  "contract_version": "2.4.0",
  "finding_id": "rf1-0d7e79aac05cfd23bcfbdd38ef617eba",
  "external_id": "ugv-007:rf1-0d7e79aac05cfd23bcfbdd38ef617eba",
  "data_source": "robodr",
  "title": "Unauthorized publisher on a motion topic",
  "description": "A participant that is not in the locked model profile announced a writer on a motion/control topic. Robot ugv-007 (model ugv-tracked-v1, site range-north, firmware 2.4.1); profile version 7; mode enforce; safety state: motion moving, human proximity not detected; attestation verified; occurrences 3.",
  "severity": "critical",
  "timestamp": "2026-09-21T14:13:24.250Z",
  "entity_context": {
    "robot": {
      "id": "ugv-007",
      "model": "ugv-tracked-v1",
      "platform_family": "linux_ros2",
      "site": "range-north",
      "firmware": {
        "version": "2.4.1",
        "sha256": "1f1f1f1f1f1f1f1f1f1f1f1f1f1f1f1f1f1f1f1f1f1f1f1f1f1f1f1f1f1f1f1f"
      }
    },
    "profile": {
      "version": "7",
      "sha256": "c0c0c0c0c0c0c0c0c0c0c0c0c0c0c0c0c0c0c0c0c0c0c0c0c0c0c0c0c0c0c0c0"
    },
    "rule_id": "robot.ros2.unauthorized_motion_writer",
    "mode": "enforce",
    "safety_state": {
      "motion": "moving",
      "human_proximity": "not_detected"
    },
    "attestation": "verified",
    "ros": {
      "participant_guid": {
        "value": "0102030405060708090a0b0c",
        "display": "0102030405060708090a0b0c",
        "taint": "adversary",
        "escaped": false,
        "truncated": false,
        "non_ascii": false,
        "mixed_script": false,
        "injection_hint": false,
        "suspicious": false,
        "original_len": 24,
        "original_sha256": "a703bc556ae080913a4a640b8eaaceb2663df3907de177334ab1064731538d5f"
      },
      "topic": {
        "value": "rt/cmd_vel",
        "display": "rt/cmd_vel",
        "taint": "adversary",
        "escaped": false,
        "truncated": false,
        "non_ascii": false,
        "mixed_script": false,
        "injection_hint": false,
        "suspicious": false,
        "original_len": 10,
        "original_sha256": "5fa7fd4c653b91301eba6d4942fa497030c848f233484fb45ace965ee66d4763"
      },
      "type_name": {
        "value": "geometry_msgs::msg::dds_::Twist_",
        "display": "geometry_msgs::msg::dds_::Twist_",
        "taint": "adversary",
        "escaped": false,
        "truncated": false,
        "non_ascii": false,
        "mixed_script": false,
        "injection_hint": false,
        "suspicious": false,
        "original_len": 32,
        "original_sha256": "e93e37e3551165e072d5e7a71a4c2737fd50e153830f80cbf2034a61290049c5"
      }
    },
    "occurrence_count": 3,
    "detail": {
      "value": "participant 0102030405060708090a0b0c not in profile publishes to motion topic /cmd_vel",
      "display": "participant 0102030405060708090a0b0c not in profile publishes to motion topic /cmd_vel",
      "taint": "adversary",
      "escaped": false,
      "truncated": false,
      "non_ascii": false,
      "mixed_script": false,
      "injection_hint": false,
      "suspicious": false,
      "original_len": 86,
      "original_sha256": "91cea75a4638788be64776ad903c67d74dc21530fbd607378b5df20d81251d50"
    }
  },
  "mitre_predictions": [
    {
      "technique_id": "T0855",
      "technique_name": "Unauthorized Command Message",
      "framework": "attack_ics",
      "provenance": "sensor"
    }
  ],
  "evidence_links": [
    "robodr-blackbox://ugv-007/12/40117?sha256=8d8d8d8d8d8d8d8d8d8d8d8d8d8d8d8d8d8d8d8d8d8d8d8d8d8d8d8d8d8d8d8d",
    "robodr-blackbox://ugv-007/12/40118?sha256=9e9e9e9e9e9e9e9e9e9e9e9e9e9e9e9e9e9e9e9e9e9e9e9e9e9e9e9e9e9e9e9e"
  ],
  "adversary_controlled_fields": [
    "/entity_context/detail",
    "/entity_context/ros/participant_guid",
    "/entity_context/ros/topic",
    "/entity_context/ros/type_name",
    "/ocsf/resources/0",
    "/ocsf/resources/1",
    "/ocsf/unmapped/robodr/detail",
    "/ocsf/unmapped/robodr/ros/participant_guid",
    "/ocsf/unmapped/robodr/ros/topic",
    "/ocsf/unmapped/robodr/ros/type_name"
  ],
  "ocsf": {
    "activity_id": 2,
    "activity_name": "Update",
    "category_uid": 2,
    "category_name": "Findings",
    "class_uid": 2004,
    "class_name": "Detection Finding",
    "type_uid": 200402,
    "type_name": "Detection Finding: Update",
    "severity_id": 5,
    "severity": "Critical",
    "status_id": 1,
    "status": "New",
    "time": 1790000004250,
    "message": "Unauthorized publisher on a motion topic",
    "count": 3,
    "metadata": {
      "version": "1.1.0",
      "product": {
        "name": "RoboDR",
        "vendor_name": "Singularity RD",
        "version": "0.1.0-alpha.1"
      },
      "uid": "re1-e10d71877f52e563b8482d1359871bb1",
      "log_name": "robodr.findings"
    },
    "finding_info": {
      "uid": "rf1-0d7e79aac05cfd23bcfbdd38ef617eba",
      "title": "Unauthorized publisher on a motion topic",
      "desc": "A participant that is not in the locked model profile announced a writer on a motion/control topic. Robot ugv-007 (model ugv-tracked-v1, site range-north, firmware 2.4.1); profile version 7; mode enforce; safety state: motion moving, human proximity not detected; attestation verified; occurrences 3.",
      "types": [
        "robot_deviation",
        "ros2_dds_discovery"
      ],
      "first_seen_time": 1790000000000,
      "last_seen_time": 1790000004250,
      "analytic": {
        "uid": "robot.ros2.unauthorized_motion_writer",
        "name": "robot.ros2.unauthorized_motion_writer",
        "type_id": 1,
        "type": "Rule"
      },
      "attacks": [
        {
          "technique": {
            "uid": "T0855",
            "name": "Unauthorized Command Message"
          }
        }
      ],
      "data_sources": [
        "ros2_dds_discovery"
      ]
    },
    "device": {
      "uid": "ugv-007",
      "name": "ugv-007",
      "type_id": 99,
      "type": "Robot",
      "model": "ugv-tracked-v1"
    },
    "evidences": [
      {
        "data": {
          "kind": "robodr.blackbox",
          "segment": 12,
          "seq": 40117,
          "sha256": "8d8d8d8d8d8d8d8d8d8d8d8d8d8d8d8d8d8d8d8d8d8d8d8d8d8d8d8d8d8d8d8d",
          "uri": "robodr-blackbox://ugv-007/12/40117?sha256=8d8d8d8d8d8d8d8d8d8d8d8d8d8d8d8d8d8d8d8d8d8d8d8d8d8d8d8d8d8d8d8d"
        }
      },
      {
        "data": {
          "kind": "robodr.blackbox",
          "segment": 12,
          "seq": 40118,
          "sha256": "9e9e9e9e9e9e9e9e9e9e9e9e9e9e9e9e9e9e9e9e9e9e9e9e9e9e9e9e9e9e9e9e",
          "uri": "robodr-blackbox://ugv-007/12/40118?sha256=9e9e9e9e9e9e9e9e9e9e9e9e9e9e9e9e9e9e9e9e9e9e9e9e9e9e9e9e9e9e9e9e"
        }
      }
    ],
    "resources": [
      {
        "type": "ros2.participant",
        "uid": "0102030405060708090a0b0c",
        "labels": [
          "taint:adversary"
        ]
      },
      {
        "type": "ros2.topic",
        "name": "rt/cmd_vel",
        "labels": [
          "taint:adversary"
        ]
      }
    ],
    "unmapped": {
      "robodr": {
        "robot": {
          "id": "ugv-007",
          "model": "ugv-tracked-v1",
          "platform_family": "linux_ros2",
          "site": "range-north",
          "firmware": {
            "version": "2.4.1",
            "sha256": "1f1f1f1f1f1f1f1f1f1f1f1f1f1f1f1f1f1f1f1f1f1f1f1f1f1f1f1f1f1f1f1f"
          }
        },
        "profile": {
          "version": "7",
          "sha256": "c0c0c0c0c0c0c0c0c0c0c0c0c0c0c0c0c0c0c0c0c0c0c0c0c0c0c0c0c0c0c0c0"
        },
        "rule_id": "robot.ros2.unauthorized_motion_writer",
        "mode": "enforce",
        "safety_state": {
          "motion": "moving",
          "human_proximity": "not_detected"
        },
        "attestation": "verified",
        "ros": {
          "participant_guid": {
            "value": "0102030405060708090a0b0c",
            "display": "0102030405060708090a0b0c",
            "taint": "adversary",
            "escaped": false,
            "truncated": false,
            "non_ascii": false,
            "mixed_script": false,
            "injection_hint": false,
            "suspicious": false,
            "original_len": 24,
            "original_sha256": "a703bc556ae080913a4a640b8eaaceb2663df3907de177334ab1064731538d5f"
          },
          "topic": {
            "value": "rt/cmd_vel",
            "display": "rt/cmd_vel",
            "taint": "adversary",
            "escaped": false,
            "truncated": false,
            "non_ascii": false,
            "mixed_script": false,
            "injection_hint": false,
            "suspicious": false,
            "original_len": 10,
            "original_sha256": "5fa7fd4c653b91301eba6d4942fa497030c848f233484fb45ace965ee66d4763"
          },
          "type_name": {
            "value": "geometry_msgs::msg::dds_::Twist_",
            "display": "geometry_msgs::msg::dds_::Twist_",
            "taint": "adversary",
            "escaped": false,
            "truncated": false,
            "non_ascii": false,
            "mixed_script": false,
            "injection_hint": false,
            "suspicious": false,
            "original_len": 32,
            "original_sha256": "e93e37e3551165e072d5e7a71a4c2737fd50e153830f80cbf2034a61290049c5"
          }
        },
        "occurrence_count": 3,
        "detail": {
          "value": "participant 0102030405060708090a0b0c not in profile publishes to motion topic /cmd_vel",
          "display": "participant 0102030405060708090a0b0c not in profile publishes to motion topic /cmd_vel",
          "taint": "adversary",
          "escaped": false,
          "truncated": false,
          "non_ascii": false,
          "mixed_script": false,
          "injection_hint": false,
          "suspicious": false,
          "original_len": 86,
          "original_sha256": "91cea75a4638788be64776ad903c67d74dc21530fbd607378b5df20d81251d50"
        }
      }
    }
  }
}
